ID,kode,NAMA ITEM DATA,Provinsi,Kabupaten,Alamat,LATITUDE,LONGITUDE,Jenis Museum,Tipe Museum,Pengelola,Foto,Pulau Jawa,Luar Jawa,Pengunjung
1,1,Museum Keprajuritan Indonesia,jakarta,jakarta timur," Jl. Raya Taman Mini, Ceger, Kec. Cipayung, Kota Jakarta Timur",-6.305699242,106.8962541,Museum Khusus,Tipe B,Badan Pelaksana Pengelola Taman Mini Indonesia Indah,lihat foto,Banten,,17000
2,2,Museum Layang-layang Indonesia,jakarta,jakarta selatan,"Jl. H. Kamang No.38 8, RT.8/RW.10, Pd. Labu, Kec. Cilandak",-6.306903489,106.7927276,Museum Khusus,Tipe C,Museum Layang-Layang,lihat foto,DKI Jakarta,,798
3,3,Museum Listrik dan Energi Baru,jakarta,jakarta timur,"Jl. Kramat Jati, Pinang Ranti, Kec. Cipayung, Kota Jakarta Timur",-6.303097058,106.9054561,Museum khusus,Tipe A,PT.PLN (PERSERO) PUSAT-PUSDIKLAT,lihat foto,Jawa Barat,,800
4,4,Museum Macan (Modern and Contemporary Art in Nusantara),jakarta,Jakarta Barat,"Jl. Panjang No.5, Kb. Jeruk, Kec. Kb. Jeruk, Kota Jakarta Barat",-6.190936731,106.7688441,Museum Khusus,Tipe A,Yayasan Museum MACAN,lihat foto,Jawa Tengah,,400
5,5,Museum Mandiri,Jakarta,Jakarta Barat,"Jl. Lapangan Stasiun No.1, RT.3/RW.6, Pinangsia, Kec. Taman Sari",-6.137343243,106.81545,Museum Khusus,Tipe A,Bank Mandiri,lihat foto,DI Yogyakarta,,7500
6,6,Museum MH. Thamrin,jakarta,kota jakarta Pusat,"Jl. Kenari 2 No.15, RW.4, Kenari",-6.193419905,106.8506003,Museum Khusus,Tipe C,Unit Pengelola Museum Kesejahteraan Jakarta,lihat foto,Jawa Timur,,3000
7,7,Museum Nasional Indonesia,jakarta,kota jakarta Pusat,"Jl. Medan Merdeka Barat No.12, Gambir",-6.175506108,106.8245942,Museum Umum,Tipe A,UPT Museum Nasional,lihat foto,,,12000
8,8,Bayt Al-Qur’an dan Museum Istiqlal,Jakarta,Jakarta Timur,Jl.RayaTaman Mini Indonesia Indah Pintu 1,-6.302470282,106.8884634,Museum Khusus,Tipe C,"Lajnah Pentashihan Mushaf Al-Qur'an,Badan Litbang dan Diklat Kementrian Agama",lihat foto,,,1200
9,9,Galeri Foto Jurnalistik Antara, Jakarta,Jakarta Pusat,"Jl.Antara N0.59,Pasar Baru,Jakarta Pusat",-6.165325492,106.8344265,Museum Khusus,Tipe B,Perum Lembaga Kantor Berita Nasional ,lihat foto,,,3000
10,10,Galeri Nasional Indonesia,Jakarta,kota Jakarta Pusat,"Jl.Medan Merdeka Timur No.14, Gambir, Jakarta Pusat.",-6.177737544,106.8336299,Museum Khusus,Tipe A,Kementrian Pendidikan dan Kebudayaan,lihat foto,,,5120
11,11,Monumen Pancasila Sakti,Jakarta,Jakarta Timur,"Jl. Raya Pondok Gede, Lubang Buaya, Kec Cipayung",-6.28489235,106.9048104,Museum Khusus,Tipe B,Pusat Sejarah Tentara Nasional Indonesia,lihat foto,,,3120
12,12,Museum Anatomi Universitas Katolik (Unika) Atmajaya,Jakarta,Jakarta Selatan,"Jl. Pluit Selatan Raya No.19, RT.16/RW.8, Penjaringan, Kec. Penjaringan",-6.124924339,106.794175,Museum Khusus,Tipe C,Fakultas Kedokteran Universitas Katolik Atma Jaya,lihat foto,,,6000
13,13,Museum Asmat TMII,Jakarta,Jakarta Timur,"Taman Mini Indonesia Indah (TMII), Jakarta Timur, DKI Jakarta 13560",-6.305456471,106.8943518,Museum Khusus,Tipe B,Yayasan Taman Mini Indonesia Indah,lihat foto,,,500
14,14,Museum Bahari,Jakarta,jakarta utara,"Jl. Pasar Ikan No.1, Penjaringan",-6.126101895,106.8068733,Museum Khusus,Tipe A,Dinas Kebudayaan Provinsi DKI Jakarta,lihat foto,,,400
15,15,Museum Bank Indonesia,Jakarta,Jakarta Barat,"Jl.Besar Utara No. 3, Pinangsia, Kecamatan Taman Sari,",-6.136466559,106.8106243,Museum Khusus,Tipe A,Direktorat Komunikasi Indonesia,lihat foto,,,13000
16,16,Museum Basoeki Abdullah ,Jakarta,Jakarta Selatan,JL.Keuangan Raya No. 19 Cilandak Barat,-6.288929702,106.7949099,Museum Khusus,Tipe A,UPT Museum Basoeki Abdullah,lihat foto,,,12000
17,17,Museum Benda-Benda Alkitab Yerushalayim,Jakarta,jakarta utara,"JL. Raya Jl. Sengon No.54, RT.1/RW.022, Klp. Gading Bar., Kec. Klp. Gading",-6.14158422,106.9022758,Museum Khusus,Belum Memenuhi Standar,Kementerian Pendidikan dan Kebudayaan,lihat foto,,,300
18,18,Museum BNI 1946,Jakarta,Jakarta Barat,"Jl. Lada No.27, RT.4/RW.6, Pinangsia, Kec. Taman Sari, Kota Jakarta Barat",-6.1359522,106.8155098,Museum Khusus,Belom di standarisasi,PT Bank Negara Indonesia,lihat foto,,,11000
19,19,Museum Ciputra Artpreneur,Jakarta,Jakarta Selatan,"Jl. Prof. DR. Satrio No.Kav. 3-5 Level 11, Kuningan, Karet Kuningan",-6.223872909,106.8228128,Museum Khusus,Belum  Memenuhi standar,Citra Art Management,lihat foto,,,10000
20,20,Museum Dharma Bhakti Kostrad,Jakarta,Jakarta Timur,"Jl. Cilangkap, Kec. Cipayung, Kota Jakarta Timur, Daerah Khusus Ibukota Jakarta 13870",-6.316968784,106.9137891,Museum Khusus,Tipe B,Komando Strategis Angkatan Darat,lihat foto,,,4000
21,21,Museum di Tengah Kebun,Jakarta,Jakarta Selatan,"Jl. Kemang Timur No.66 7, RT.7/RW.3, Bangka, Kec. Mampang Prpt",-6.266873117,106.8259953,Museum Swasta,Belum Memenuhi Standar,Mirza Djalil,lihat foto,,,20000
22,22,Museum DPR RI,Jakarta,Jakarta Pusat," Jl. Gatot Subroto Lantai 2, Gelora, Kecamatan Tanah Abang",-6.210167337,106.8003328,Museum Khusus,Tipe B,Sekretariat Jenderal Dewan Perwakilan Rakyat Republik Indonesia,lihat foto,,,16000
23,23,Museum Fauna Indonesia “Komodo” dan Taman Reptilia,Jakarta,Jakarta Timur,"Jl. Taman Mini Indonesia Indah, RW.2, Ceger, Kec. Cipayung",-6.303598906,106.9016491,Museum Khusus,Tipe C,Yayasan Harapan Kita,lihat foto,,,32000
24,24,Museum Graha Widya Patra (Minyak dan Gas Bumi),Jakarta,Jakarta Timur,"Jl. Taman Mini Indonesia Indah, Bambu Apus, Kec. Cipayung",-6.302075408,106.9054797,Museum Khusus,Tipe B,PT Pertamina,lihat foto,,,800
25,25,Museum Hakka Indonesia,Jakarta,Jakarta Timur," Jl.Raya Taman Mini, Ceger, Kecamatan Cipayung ",-6.305094859,106.904697,Museum Khusus,Tipe B,Yayasan Hakka Indonesia Sejahtera,lihat foto,,,400
26,26,Museum Harry Darsono,Jakarta,Jakarta Selatan,"Jl. Cilandak Tengah Raya No.71, RT.2/RW.13, Cilandak Bar., Kec. CilandaK",-6.288785879,106.8007581,Museum Pribadi,Belum Memenuhi Standar,"Sir Dr. Harry Darsono, PhD,",lihat foto,,,12000
27,27,Museum Indonesia,Jakarta,Jakarta Timur,"Jl. Taman Mini Indonesia Indah, Ceger, Kec. Cipayung",-6.300460132,106.8943625,Museum Khusus,Tipe B,PT Bhumi Visatanda Indonesia,lihat foto,,,25000
28,28,Museum Jenderal Besar Dr. A.H. Nasution,Jakarta,kota Jakarta Pusat,"Jl. Teuku Umar No.40, RT.1/RW.1, Gondangdi, Kec. Menteng",-6.192950528,106.8332868,Museum Khusus,Tipe C,Dinas Sejarah TNI AD,lihat foto,,,45000
29,29,Museum Joang 45 ,Jakarta,kota Jakarta Pusat,"Jl. Menteng Raya No.31, RT.01/RW.10 Kebon Sirih, Menteng,",-6.185082794,106.8390751,Museum Khusus,Tipe C,Unit Pengelola Museum Kesejahteraan Jakarta,lihat foto,,,1200
30,30,Museum Katedral Jakarta,Jakarta,kota Jakarta Pusat,"Jl. Katedral, Ps. Baru, Kecamatan Sawah Besar",-6.168100562,106.8378044,Museum Khusus,Tipe B,Paroki Gereja Katedral Jakarta,lihat foto,,,3120
31,31,Museum Kebangkitan Nasional,Jakarta,kota Jakarta Pusat,"Jl. Abdul Rachman Saleh No.26, Senen, Kec. Senen, Kota Jakarta Pusat",-6.177814946,106.8404626,Museum Khusus,Tipe A,Museum Kebangkitan Nasional,lihat foto,,,6000
32,32,Museum Kehutanan “Ir. Djamaludin Suryohadikusumo,Jakarta,Jakarta Selatan,Jl.Gatot Subroto,-6.206594328,106.7991724,Museum Khusus,Tipe C,Kementrian Lingkungan Hidup dan Kehutanan,lihat foto,,,500
33,33,Museum Olahraga Nasional,jakarta,kota jakarta timur,"Jl. Hankam Raya No.8, RT.1/RW.2, Ceger, Kec. Cipayung, Kota Jakarta Timur",-6.304085317,106.8893333,Museum Khusus,Tipe B,Kementrian Pemuda Dan Olahraga,lihat foto,,,400
34,34, Museum Pemadam Kebakaran,jakarta,jakarta timur,"Jl. Komp. TMII Pintu 3, Lubang Buaya, Kec. Cipayung",-6.294476982,106.9360618,Museum Khusus,Tipe C,Dinas Penanggulangan dan Penyelamatan Provinsi DKI Jakarta,lihat foto,,,13000
35,35, Museum Penerangan,jakarta,jakarta timur,Jl. Taman Mini Indonesia Indah,-6.299314613,106.8939319,Museum Khusus,Tipe A,Kementrian Komunikasi dan Informatika,lihat foto,,,12000
36,36,Museum Perumusan Naskah Proklamasi,jakarta,kota Jakarta Pusat,"Jl. Imam Bonjol No.1, RT.9/RW.4, Menteng, Kec. Menteng",-6.19953172,106.8351548,Museum Khusus,Tipe B,"Kementerian Pendidikan, Kebudayaan, Riset, dan Teknologi Republik Indonesia",lihat foto,,,300
37,37,Museum Polri,jakarta,jakarta selatan,"Jl. Trunojoyo No.3, RT.5/RW.2, Selong, Kec. Kby. Baru",-6.23929838,106.8031497,Museum Khusus,Tipe C,Museum Polisi Republik Indonesia,lihat foto,,,11000
38,38,Museum Prangko,jakarta,jakarta timur,"Jl.Taman Mini Indonesia Indah, Jalan Taman Mini Indonesia Indah",-6.303970814,106.9022768,Museum Khusus,Tipe C,PT.Pos Indonesia,lihat foto,,,10000
39,39,Museum Prasasti Jakarta,jakarta,kota jakarta Pusat,"Jl. Tanah Abang I No.1, RT.11/RW.8, Petojo Sel., Kecamatan Gambir",-6.171840101,106.8174245,Museum Khusus,Tipe C,"Unit Pengelola Museum Seni, Dinas Kebudayaan Provinsi DKI Jakarta",lihat foto,,,32000
40,40,Museum Purna Bhakti Pertiwi,jakarta,jakarta timur, Jl. Taman Mini Indonesia Indah,-6.299706257,106.8898746,Museum Khusus,Tipe C,Yayasan Harapan Kita,lihat foto,,,19000
41,41,Museum Pusaka,jakarta,jakarta timur,"Jl. Taman, Mini, Kec. Cipayung, Kota Jakarta Timur3",-6.30509674,106.8966639,Museum Khusus,Tipe C,"PT.Taman Wisata Candi Brobudur,Prambanan dan Ratu Boko",lihat foto,,,22000
42,42,Museum Sasmitaloka Pahlawan Revolusi Jenderal TNI A. Yani,jakarta,kota jakarta Pusat,"Jl. Lembang No.67, RT.11/RW.7, Menteng",-6.20395269,106.8379934,Museum Khusus,Tipe C,TNI Angkatan Darat (TNI AD),lihat foto,,,50000
43,43,Museum Satriamandala,jakarta,jakarta selatan,"Jl. Gatot Subroto No.14, RT.6/RW.1",-6.231583289,106.8202528,Museum Khusus,Belom di standarisasi,Museum Satriamandala,lihat foto,,,3000
44,44,Museum Sejarah Jakarta,jakarta,Jakarta Barat,"JL.Taman Fatahillah No.1, Pinangsia",-6.134474617,106.8104247,Museum Umum,Tipe A,Dinas Kebudayaan Provinsi DKI Jakarta,lihat foto,,,12000
45,45,Museum Seni Rupa dan Keramik,jakarta,Jakarta Barat,"Jl. Pos Kota No.2 9, RT.9/RW.7, Pinangsia",-6.133449077,106.8170411,Museum Khusus,Tipe A,Unit Penggelola Museum Seni,lihat foto,,,2000
46,46,Museum Sumpah Pemuda,jakarta,kota jakarta Pusat,"Jl. Kramat Raya No.106, RT.2/RW.9, Kwitang",-6.182814824,106.8459689,Museum Khusus,Tipe A,"Kementerian Pendidikan, Kebudayaan, Riset, dan Teknologi Republik Indonesia (Kemendikbudristek RI)",lihat foto,,,3000
47,47,Museum Tekstil Jakarta,jakarta,Jakarta Barat,"Jl. K.S. Tubun, Kota Bambu Sel., Kec. Palmerah",-6.187451416,106.8148009,Museum Khusus,Tipe A,Dinas Kebudayaan Provinsi DKI Jakarta,lihat foto,,,5120
48,48,Museum Timor Timur,jakarta,jakarta timur,Jl.Taman Mini Indonesia Indah,-6.30314139,106.9020584,museum khusus,Tipe C,Pemerintah Indonesia,lihat foto,,,3120
49,49,Museum Tragedi 12 Mei 1998 Universitas Trisakti,jakarta,Kota Jakarta Barat,"Jl.Tomang, Kec. Grogol petamburan",-6.167999059,106.7909749,Museum Khusus,Tipe C,"Universitas Trisakti,",lihat foto,,,6000
50,50,Museum Transportasi,jakarta,jakarta timur,Jl. Taman Mini I,-6.30410184,106.9008619,Museum Khusus,Tipe B,Kementrian Perhubungan,lihat foto,,,1200
51,51,Museum Wayang,jakarta,Jakarta Barat,"Jl.Pintu Besar Utara No.27 Pinangsia, RT.3/RW.6, Kota Tua, Kec. Taman Sari",-6.134029708,106.816788,Museum Khusus,Tipe B,"Unit Pengelola Museum Seni, Dinas ",lihat foto,,,400
52,52,Museum Batik Indonesia,jakarta,jakarta timur,Taman Mini Indonesia Indah,-6.305445187,106.8969545,Museum Khusus,Belom di standarisasi,Direktorat Jendral Kebudayaan,lihat foto,,,15000
53,53,Museum Betawi,jakarta,Jakarta Selatan,"Jl. Situ Babakan No.47, RT.13/RW.8",-6.338297998,106.8259937,Museum khusus,Belom di standarisasi,Unit Pengelola Kawasan Perkampungan Budaya Betawi,lihat foto,,,14000
54,54,Museum Benteng Heritage,Banten,Tangerang,"Jl.cilame No 20,pasar lama Tangerang ,Banten",-6.177748246,106.6309559,Museum Khusus,Belom di standarisasi,Udaya Halim,lihat foto,,,300
55,55,Museum Multatuli,Banten,kabupaten lebak,Jl.Alun-alun Timur No.8,-6.360434515,106.2473369,Museum Umum,Tipe C,"Dinas Kebudayaan Dan Pariwisata Kabupaten Lebak,UPT Museum Multatuli",lihat foto,,,11000
56,56,Museum Negeri Provinsi Banten,Banten,Kota Serang,Jl. Brigjen KH Samun No. 5,-6.03814023,106.1584456,Museum Umum,Belum Memenuhi Standar,Yayasan Museum Semparaja Bima,lihat foto,,,1000
57,57,Museum Sepeda Pramuka Keliling Dunia,Banten,Kota Serang,"Jl.Raya Serang – Pandeglang Km. 5, Karundang",-6.152840022,106.1605051,Museum Khusus,Tipe C,Yayasan Syariful Ichsan,lihat foto,,,40000
58,58,Museum Situs Kepurbakalaan Banten Lama,Banten,Kota Serang,Jl.Banten lama,-6.0361046,106.1560885,Museum Umum,Tipe C,Yayasan Museum Semparaja Bima,lihat foto,,,17000
59,59,Museum Tari dan Musik Nusantara,Banten,Kota Tangerang Selatan,Jl.Elang Raya No.1,-6.29929,106.733947,Museum Khusus,Belum Memenuhi Standar,Puspo Budoyo,lihat foto,,,17000
60,60,Museum Universitas Pelita Harapan,Banten,Kota Tangerang ,"Jl.Boulevard Diponegoro Blok C,Dua,Kec.Dua",-6.227488953,106.6113522,Museum Khusus,Tipe C,Universitas Pelita Harapan,lihat foto,,,798
61,61,Monumen & Museum PETA,jawa barat,Kota Bogor,"Jl. Jend. Sudirman No.35, RT.01/RW.05, Pabaton",-6.584938616,106.7967471,Museum Khusus,Tipe C,Dinas Sejarah TNI Angkatan Darat,lihat foto,,,800
62,62,Monumen Perjuangan Rakyat Jawa Barat,jawa barat,Kota Bandung,"Jl. Dipati Ukur No.48, Lebakgede",-6.892921438,107.6229716,Museum Khusus,Tipe C,Dinas Pariwisata Dan Kebudayaan Provinsi Jawa Barat,lihat foto,,,400
63,63,Museum Amerta Dirgantara Mandala Lanud Suryadarma,jawa barat,Subang,"Kawasan Pangkalan TNI Angkatan Udara Suryadarma, Kalijati, Subang, Jawa Barat",-6.535503153,107.6671398,Museum Khusus,Tipe C,Dinas Penerangan TNI Angkatan Udara,lihat foto,,,7500
64,64,Museum Barli,jawa barat,Kota Bandung,"Jl. Prof. Dr. Sutami No. 91, Sukarasa, Kecamatan Sukasari, Kota Bandung, Jawa Barat 40152",-6.877436476,107.5904284,Museum Khusus,Tipe c,Barli Sasmitawinata,lihat foto,,,3000
65,65,Museum Bio Farma,jawa barat,Kota Bandung,Jl.Pasteur No.28,-6.899248112,107.6001491,Museum Khusus,Belom Memenuhi Standar,Corporate Cominications Biofarma,lihat foto,,,12000
66,66,Museum Daerah Kabupaten Subang,jawa barat,Subang,Jl. Ade Irma Suryani Nasution No. 2,-6.566952819,107.7835699,Museum Umum,Tipe C,Pemerintah Daerah Kabupaten Subang melalui Dinas Pendidikan dan Kebudayaan,lihat foto,,,1200
67,67,Museum Galuh Pakuan,jawa barat,Ciamis,Jl. K.H. Ahmad Dahlan No. 53,-7.332612976,108.3505241,Museum Khusus,Tipe C,Ilham Purwa,lihat foto,,,3000
68,68,Museum Gedung Perundingan Linggarjati,jawa barat,Kuningan,"Desa Linggarjati, Kecamatan Cilimus, Kabupaten Kuningan, Jawa Barat",-6.88106262,108.4756491,Museum Khusus,Tipe C,Dinas Pendidikan Dan Kebudayaan Kuningan,lihat foto,,,5120
69,69,Museum Gedung Pusaka Keraton Kanoman,jawa barat,Kota Cirebon,"Jl.Merdeka No. 28, Kelurahan Lemahwungkuk, Kota Cirebon, Jawa Barat",-6.722783027,108.5685859,Museum Khusus,Tipe C,P.R.M. Hamzah,lihat foto,,,3120
70,70,Museum Gedung Sate,jawa barat,Kota Bandung,Jl.Diponegoro No.22,-6.901572792,107.6199415,Museum Khusus,Tipe C,Biro Umum & Biro Humas & Keprotokolan,lihat foto,,,6000
71,71,Museum Geologi Bandung,jawa barat,Kota Bandung,Jl.Diponegoro No.57,-6.899906715,107.6230003,Museum Khusus,Tipe A,Unit Pelaksaan Teknis Museum Geologi,lihat foto,,,500
72,72, Museum Kepresidenan Republik Indonesia “Balai Kirti”,jawa barat,Kota Bogor,Jl. Ir. H. Juanda No.1,-6.598296,106.7951098,Museum Khusus,Tipe B,"Kementrian Pendidikan ,Kebudayaan,Riset dan Teknologi",lihat foto,,,400
73,73,Museum Keraton Kacirebonan,jawa barat,Kota Cirebon,Jalan Kasepuhan No. 43,-6.724441206,108.5662572,Museum Khusus,Tipe A,Dinas Kebudayaan dan Pariwisata Kota Cirebon,lihat foto,,,13000
74,74,Museum Konferensi Asia Afrika,jawa barat,Kota Bandung,JL. Asia Afrika No. 65,-6.920257139,107.6115165,Museum Khusus,Tipe A,Direktorat Jenderal Informasi dan Diplomasi Publik Kementerian Luar Negeri Republik Indonesia,lihat foto,,,12000
75,75,Museum Mandala Wangsit Siliwangi,jawa barat,Kota Bandung,"JL.Mayor Lembong No. 38,",-6.917059224,107.6104688,Museum Khusus,Belom Memenuhi Standar,Tentara Nasional Indonesia (TNI) melalui Komando Daerah Militer (Kodam) III/Siliwangi,lihat foto,,,300
76,76,Museum Nasional Sejarah Alam Indonesia,jawa barat,Kota Bogor,Jl.IR.H.Juanda No. 22-24,-6.597969661,106.795723,Museum Khusus,Tipe B,Pusat Penelitian Biologi - LIPI,lihat foto,,,11000
77,77,Museum Negeri Provinsi Jawa Barat Sri Baduga,jawa barat,Kota Bandung,JL. BKR No. 185,-6.93748012,107.6041145,Museum Umum,Tipe A,Dinas Pariwisata dan Kebudayaan Provinsi Jawa Barat,lihat foto,,,10000
78,78,Museum Nyamuk Loka Litbang P2B2 Ciamis,jawa barat,Pangandaran,"Jl. Raya Pangandaran Km 3, Desa Babakan",-7.672965339,108.6800649,Museum Khusus,Belom Memenuhi Standar,Dinas Kesehatan Kabupaten Ciamis dan dikelola oleh Unit Pengelola Teknis Museum Nyamuk Litbang P2B2 Ciamis,lihat foto,,,4000
79,79,Museum Palagan Perjuangan 1945 Bojongkokosan,jawa barat,Sukabumi,Jalan Siliwangi No. 75,-6.826018266,106.7598937,Museum Khusus,Tipe B,"kepada Dinas Pariwisata, Kebudayaan, Pemuda, dan Olahraga Kabupaten Sukabumi",lihat foto,,,20000
80,80,Museum Pangeran Cakrabuana,jawa barat,Cirebon,Jalan Sunan Drajat No. 9,-6.762325147,108.4782472,Museum Khusus,Belom di standarisasi,"Dinas Kebudayaan, Pariwisata, Pemuda, dan Olahraga Kabupaten Cirebon.",lihat foto,,,16000
81,81,Museum Pendidikan Nasional Universitas Pendidikan Indonesia (Mupenas),jawa barat,Kota Bandung,Jalan Dr. Setiabudhi No. 229,-6.859737829,107.5947966,Museum Khusus,Tipe A,"Prof. Dr. Leli Yulifar, M.Pd.",lihat foto,,,32000
82,82,Museum Perbendaharaan,jawa barat,Kota Bandung,Jalan Diponegoro No. 59,-6.900516624,107.6237428,Museum Khusus,Belom di standarisasi,Direktorat Jenderal Perbendaharaan,lihat foto,,,800
83,83,Museum Perjuangan Bogor,jawa barat,Kota Bogor,Jalan Merdeka No. 56,-6.592612353,106.7912564,Museum Khusus,Tipe C,Dinas Pariwisata dan Kebudayaan Kota Bogor,lihat foto,,,400
84,84,Museum Pos Indonesia,jawa barat,Kota Bandung,Jl. Cilaki No.73,-6.901294621,107.6230055,Museum Khusus,Belom Memenuhi Standar,PT.Pos Indonesia,lihat foto,,,12000
85,85,Museum Prabu Geusan Ulun,jawa barat,Sumedang,Jl.Prabu Geusan Ulun No. 40,-6.860815689,107.9214685,Museum Khusus,Tipe C,Yayasan Pangeran Sumedang,lihat foto,,,25000
86,86,Museum Pusaka Keraton Kasepuhan,jawa barat,Kota Cirebon,Jalan Kasepuhan No. 43,-6.71191994,108.5665165,Museum Khusus,Tipe A,Keraton Kasepuhan,lihat foto,,,45000
87,87,Museum Rumah Sejarah Kalijati,jawa barat,Subang,"Komplek Garuda E25 Lanud Suryadarma, Jalan Kalijati Barat",-6.523886884,107.661969,Museum Khusus,Tipe,Dinas Pendidikan dan Kebudayaan Kabupaten Subang,lihat foto,,,1200
88,88,Museum Sejarah Sunda Prabu Siliwangi,jawa barat,Sukabumi,Jl. Merbabu Perum Gading Kencana Asri ,-6.906530232,106.9118587,Museum Umum,Tipe C," RH. Erwin Hendarwin, SE., MBA., MM., Ph.D",lihat foto,,,3120
89,89,"Museum Situs Cagar Budaya Batujaya,",jawa barat,Karawang,"Jalan Candi Jiwa, Dusun Sumurjaya, RT.11/RW.04",-6.056526735,107.1583194,Museum Khusus,Tipe A,Dinas Kebudayaan dan Pariwisata Provinsi Jawa Barat,lihat foto,,,6000
90,90,Museum Talaga Manggung,jawa barat,Majalengka,Jl. Talaga Majalengka No. 1,-6.984981155,108.3115134,Museum Khusus,Tipe A,Yayasan Talaga Manggung,lihat foto,,,500
91,91,Museum Taman Purbakala,jawa barat,Kuningan,Jl. Museum Taman Purbakala,-6.962369998,108.4703233,Museum Khusus,Tipe A,Dinas Kebudayaan dan Pariwisata Kabupaten Kuningan,lihat foto,,,400
92,92,Museum Tanah dan Pertanian,jawa barat,Kota Bogor,"Jl. Ir. H. Juanda No. 98,",-6.60349004,106.798726,Museum Khusus,Tioe A,Kementerian Pertanian Republik Indonesia,lihat foto,,,13000
93,93,Museum Universitas Galuh,jawa barat,Ciamis,Jl. R. E. Martadinata No. 150,-7.313932736,108.3563231,Museum Umum,Tipe A,"Program Studi Sejarah, Fakultas Keguruan dan Ilmu Pendidikan",lihat foto,,,12000
94,94,Museum Zoologi Bogor,jawa barat,Kota Bogor,Jl. Ir. H. Juanda No. 9,-6.602718156,106.8000695,Museum Khusus,Tipe A,Badan Riset dan Inovasi Nasional,lihat foto,,,300
95,95,Museum Kereta Api Ambarawa,jawa Tengah,Semarang,"Jl. Stasiun No.1, Panjang Kidul, Panjang",-7.264469123,110.405586,Museum Khusus,Tipe A,KAI Wisata,lihat foto,,,11000
96,96,Monumen Pers Nasional,jawa Tengah,Kota Surakarta,Jl. Gajahmada No.59,-7.564250705,110.8154273,Museum khusus,Tipe B,Kementerian Komunikasi dan Informatika Republik Indonesia,lihat foto,,,10000
97,97,Museum Rekor Dunia Indonesia,jawa Tengah,Kota Semarang,Jl. Perintis Kemerdekaan No.275,-6.959602028,110.7261084,Museum Khusus,Tipe A,MURI – Museum Rekor Dunia Indonesia,lihat foto,,,32000
98,98,Museum Bank Rakyat Indonesia,jawa Tengah,Banyumas,Jl. Jend. Sudirman No.57,-7.423747937,109.2260338,museum khusus,Tipe A,Sekretaris Perusahaan BRI,lihat foto,,,19000
99,99,Museum Batik Pekalongan,jawa Tengah,Pekalongan,Jl. Jetayu No.3,-6.877916984,109.6787811,Museum Khusus,Tipe B,Unit Pelaksana Teknis Daerah (UPTD) Museum Batik,lihat foto,,,22000
100,100,Museum BPK RI,jawa Tengah,Kota Magelang,Jl. Pangeran Diponegoro No.1,-7.473976891,110.2174291,Museum Khusus,Tipe A,Unit Pelaksana Teknis Museum BPK,lihat foto,,,50000
101,101,Museum Bumiputera 1912,jawa Tengah,Kota Magelang,Jl. Ahmad Yani Jl. Poncol No.21,-7.472357642,110.2178908,Museum Khusus,Tipe A,AJB Bumiputera 1912,lihat foto,,,3000
102,102,Museum OHD (Oei Hong Djien),jawa Tengah,Kota Magelang,Jl. Jenggolo No.14,-7.48116113,110.2198905,Museum Khusus,Tipe A,Dr. Oei Hong Djien,lihat foto,,,12000
103,103,Museum Glagah Wangi,jawa Tengah,Demak,Jalan Sultan Fatah No. 53,-6.89590993,110.6367637,Museum Khusus,Tipe A,Unit Pelaksana Teknis Daerah,lihat foto,,,2000
104,104,"Museum, Guesthouse & Creative Space Nyah Lasem",jawa Tengah,Rembang,"Gang Karangturi V No. 2, Desa Karangturi,",-6.700849938,111.4477988,Museum Khusus,Tipe A,A. Soesantio dan dikelola oleh Yayasan Lasem Heritage,lihat foto,,,3000
105,105,Museum H. Widayat,jawa Tengah,Magelang,Jl. Soekarno Hatta No.32,-7.600051674,110.2242912,Museum Khusus,Tipe A,PT Haji Widayat,lihat foto,,,5120
106,106,Museum Isdiman,jawa Tengah,Semarang,"Jl. Panjang Lor, Panjang, Kec. Ambarawa, Kabupaten Semarang, Jawa Tengah 50614",-7.25985245,110.4027218,Museum Khusus,Tipe A,Unit Pelaksana Teknis Daerah,lihat foto,,,3120
107,107,Museum Jamu Jago,jawa Tengah,Kota Semarang,Jl. Dr. Setiabudi No.179,-7.064121348,110.3999722,Museum Khusus,Tipe A,Jaya Suprana,lihat foto,,,6000
108,108,Museum Ranggawarsita,jawa Tengah,Kota Semarang,Jalan Abdulrahman Saleh No. 1,-6.985239058,110.3850212,Museum Umum,Tipe A,Pemerintah Provinsi Jawa Tengah,lihat foto,,,1200
109,109,Museum Kailasa,jawa Tengah,Banjarnegara,"Karangsari, Dieng Kulon, Kecamatan Batur, Kabupaten Banjarnegara",-7.208266488,109.9058213,Museum Umum,Tipe A,Pemerintah Kabupaten Banjarnegara,lihat foto,,,400
110,110,Museum Kapal Samudra Raksa,jawa Tengah,Magelang,"Jl. Badrawati, Kw. Candi Borobudur",-7.604505195,110.2039087,Museum Khusus,Tipe A,"PT Taman Wisata Candi Borobudur, Prambanan & Ratu Boko",lihat foto,,,15000
111,111,Museum Karmawibangga Taman Wisata Candi Borobudur,jawa Tengah,Magelang,"Jl. Badrawati, Kw. Candi Borobudur",-7.60394932,110.2043343,Museum Khusus,Tipe A,"PT Taman Wisata Candi Borobudur,",lihat foto,,,14000
112,112,Museum Karst Indonesia,jawa Tengah,Wonogiri,"Desa Gebangharjo, Kecamatan Pracimantoro, Kabupaten Wonogiri, Jawa Tengah",-8.041325389,110.7817752,Museum Khusus,Tipe A,Pemerintah Kabupaten Wonogiri,lihat foto,,,300
113,113,Museum Keris Nusantara,jawa Tengah,Kota Surakarta,Jalan Bhayangkara No. 2,-7.568393078,110.8123957,Museum Khusus,Tipe A,Dinas Kebudayaan Kota Surakarta,lihat foto,,,11000
114,114,Museum Kretek,jawa Tengah,Kudus,Jalan Getas Pejaten No. 155,-6.826568543,110.8391244,Museum Khusus,Tipe A,Dinas Kebudayaan dan Pariwisata Kabupaten Kudus,lihat foto,,,1000
115,115,Museum Mahameru Blora,jawa Tengah,Blora,"Jalan Reksodiputro, Kompleks Taman Tirtonadi",-6.974100502,111.4181414,Museum Khusus,Tipe A,Yayasan Mahameru,lihat foto,,,40000
116,116,Museum Manusia Purba Klaster,jawa Tengah,Sragen,"Kecamatan Kalijambe, Kabupaten Sragen",-7.44119203,110.8384722,Museum Khusus,Tipe A,Balai Pelestarian Situs Manusia Purba Sangiran,lihat foto,,,17000
117,117,Museum Masjid Agung Demak,jawa Tengah,Demak,Jalan Sultan Patah No. 57,-6.894326678,110.6371137,Museum Khusus,Tipe A,Dinas Kebudayaan dan Pariwisata Kabupaten Demak,lihat foto,,,17000
118,118,Museum Misi Muntilan,jawa Tengah,Magelang,Jl. Kartini No.3,-7.581503857,110.2935774,Museum Khusus,Tipe A,Keuskupan Agung Semarang,lihat foto,,,798
119,119,Museum Panglima Besar Jenderal Sudirman,jawa Tengah,Banyumas,"Jl. Patimura No.240A, RW.1, Dusun II",-7.419594408,109.1967874,Museum Khusus,Tipe A,Pemerintah Kabupaten Banyumas,lihat foto,,,800
120,120,Museum Perjuangan Mandala Bhakti,jawa Tengah,Kota Semarang,Jalan Mgr Soegijapranata No.1,-6.98457916,110.4098819,Museum Khusus,Tipe A ,"Kodam IV/Diponegoro,",lihat foto,,,400
121,121,Museum Prof. Dr. R. Soegarda Poerbakawatja,jawa Tengah,Purbalingga,Jl. Purbalingga - Klampok No.142,-7.38828216,109.3621687,Museum Khusus,Tipe A,Dinas Pendidikan dan Kebudayaan Kabupaten Purbalingga,lihat foto,,,7500
122,122,Museum R. Hamong Wardoyo,jawa Tengah,Boyolali,"Jl. Pandanaran No.19, ",-7.538765087,110.6173551,Museum Umum,Tipe A,Pemerintah Kabupaten Boyolali,lihat foto,,,3000
123,123,Museum RA Kartini Jepara,jawa Tengah,Jepara,"Jl. Kartini, Panggang I",-6.588663282,110.6682883,Museum Umum,Tipe C,Dinas Pariwisata dan Kebudayaan Kabupaten Jepara,lihat foto,,,12000
124,124,Museum R.A. Kartini Rembang,jawa Tengah,Rembang ,Jl. Gatot Subroto No.8,-6.707088439,111.3513255,Museum Khusus,Tipe C,Dinas Kebudayaan dan Pariwisata Kabupaten Rembang,lihat foto,,,1200
125,125,Museum Radya Pustaka,jawa Tengah,Kota Surakarta,Jl. Slamet Riyadi No.275,-7.568313368,110.8153016,Museum Umum,Tipe C,Yayasan Paheman Radya Pustaka Surakarta,lihat foto,,,3000
126,126,Museum Situs Purbakala Patiayam,jawa Tengah,Kudus,"Desa Terban, Kecamatan Jekulo, Kabupaten Kudus, Jawa Tengah",-6.793725898,110.9389302,Museum Khusus,Tipe C,Dinas Kebudayaan dan Pariwisata Kabupaten Kudus,lihat foto,,,5120
